{
  "owner": {
    "forename": "Celestino",
    "surname": "Schaefer"
  },
  "title": "Excepturi rerum voluptatem aliquid placeat dolorem nihil est.",
  "description": "Quasi hic saepe officia fugiat praesentium. Excepturi doloremque maiores in ad autem voluptatem. Doloremque fugiat maiores pariatur ut. Tempore ut omnis ea. Molestias ut fuga quod.",
  "items": [
    {
      "status": "doing",
      "body": "Tempora natus deleniti sint eligendi a repellat odio."
    },
    {
      "status": "doing",
      "body": "Et natus amet quae."
    },
    {
      "status": "doing",
      "body": "Sapiente ut maiores eos omnis temporibus nisi dolore."
    },
    {
      "status": "ready",
      "body": "Illum error unde."
    },
    {
      "status": "doing",
      "body": "Enim illum nobis ex temporibus voluptatum."
    }
  ]
}